{
  "id": "xiaomi_poco_f3",
  "manufacturer": "Xiaomi",
  "model": "Poco F3",
  "codename": "alioth",
  "soc_vendor": "Qualcomm",
  "soc_name": "Snapdragon 870 (SM8250-AC)",
  "android_version": "Android 11-13",
  "bootloader_locked": true,
  "storage_type": "UFS 3.1",
  "modes": [
    {
      "name": "edl",
      "display_name": "EDL 9008",
      "usb_ids": [
        {
          "vid": 1478,
          "pid": 36872
        }
      ],
      "port_description_patterns": [
        "9008",
        "QDLoader"
      ],
      "entry_methods": [
        "fastboot oem edl",
        "EDL cable"
      ],
      "exit_methods": [
        "Power hold 10s"
      ],
      "tools": [
        "edl",
        "QFIL"
      ],
      "description": "Qualcomm EDL."
    },
    {
      "name": "fastboot",
      "display_name": "Fastboot",
      "usb_ids": [
        {
          "vid": 1478,
          "pid": 18586
        }
      ],
      "port_description_patterns": [
        "fastboot",
        "Xiaomi"
      ],
      "entry_methods": [
        "adb reboot bootloader",
        "Volym Ner + Power"
      ],
      "exit_methods": [
        "fastboot reboot"
      ],
      "tools": [
        "fastboot"
      ],
      "description": "Fastboot."
    },
    {
      "name": "adb",
      "display_name": "ADB",
      "usb_ids": [],
      "port_description_patterns": [
        "ADB"
      ],
      "entry_methods": [
        "Enable USB debugging"
      ],
      "exit_methods": [
        "adb disconnect"
      ],
      "tools": [
        "adb"
      ],
      "description": "ADB."
    },
    {
      "name": "recovery",
      "display_name": "Recovery",
      "usb_ids": [],
      "port_description_patterns": [
        "recovery"
      ],
      "entry_methods": [
        "adb reboot recovery"
      ],
      "exit_methods": [
        "Reboot system now"
      ],
      "tools": [
        "adb"
      ],
      "description": "Stock recovery."
    }
  ],
  "frp_methods": [
    {
      "id": "fastboot_erase_frp",
      "name": "Fastboot Erase FRP",
      "category": "Fastboot",
      "success_rate": 0.95,
      "risk_level": "LOW",
      "prerequisites": [
        "Unlocked bootloader"
      ],
      "steps": [],
      "requires_screen": false,
      "requires_adb": false,
      "requires_edl": false,
      "requires_root": false,
      "cost": "Free",
      "commands": [
        "fastboot:erase frp",
        "fastboot:reboot"
      ]
    }
  ],
  "unlock_methods": [
    {
      "id": "xiaomi_official",
      "name": "Xiaomi Mi Unlock",
      "success_rate": 0.95,
      "risk_level": "MEDIUM",
      "prerequisites": [
        "Mi Account 30+ days"
      ],
      "steps": [
        {
          "step": 1,
          "description": "Bind Mi Account"
        }
      ],
      "commands": [],
      "official": true
    }
  ],
  "firehoses": [
    {
      "filename": "prog_firehose_ddr_SM8250.mbn",
      "priority": 1,
      "notes": "SDM870"
    }
  ],
  "partitions": [
    {
      "name": "frp",
      "purpose": "FRP",
      "frp_relevant": true,
      "backup_before_write": true
    },
    {
      "name": "persist",
      "purpose": "Persist",
      "frp_relevant": true,
      "backup_before_write": true
    },
    {
      "name": "userdata",
      "purpose": "Data",
      "frp_relevant": true,
      "backup_before_write": true
    },
    {
      "name": "boot",
      "purpose": "Kernel",
      "frp_relevant": false,
      "backup_before_write": true
    },
    {
      "name": "super",
      "purpose": "Dynamic",
      "frp_relevant": false,
      "backup_before_write": true
    },
    {
      "name": "vbmeta",
      "purpose": "VB",
      "frp_relevant": false,
      "backup_before_write": true
    }
  ],
  "at_commands": [
    {
      "command": "AT+CFUN=1,1",
      "description": "Modem reset",
      "modifies_nvram": false,
      "risk_level": "LOW"
    }
  ],
  "service_codes": [
    {
      "code": "*#06#",
      "function": "IMEI"
    },
    {
      "code": "*#*#6484#*#*",
      "function": "CIT"
    },
    {
      "code": "*#*#4636#*#*",
      "function": "Phone info"
    }
  ],
  "talkback_shortcuts": {}
}