{
  "id": "google_pixel_6a",
  "manufacturer": "Google",
  "model": "Pixel 6a",
  "codename": "bluejay",
  "soc_vendor": "Google",
  "soc_name": "Google Tensor (GS101)",
  "android_version": "Android 12-14",
  "storage_type": "UFS 3.1",
  "bootloader_locked": true,
  "metadata": {
    "boot_chain": "PBL -> XBL -> ABL -> Linux Kernel",
    "edl_support": "Yes (GDSA protocol via Samsung GDSA)",
    "frp_location": "persist + misc",
    "sector_size": 4096,
    "slot_count": 2
  },
  "modes": [
    {"name": "fastboot", "display_name": "Fastboot / Bootloader", "usb_ids": [{"vid": 6353, "pid": 20192}], "port_description_patterns": ["fastboot", "Google", "GS101"], "entry_methods": ["adb reboot bootloader", "Volym Ner + Power"], "exit_methods": ["fastboot reboot"], "tools": ["fastboot"], "description": "Standard fastboot mode."},
    {"name": "edl", "display_name": "EDL (GDSA)", "usb_ids": [{"vid": 6353, "pid": 36752}], "port_description_patterns": ["9008", "GDSA", "Google EDL"], "entry_methods": ["adb reboot edl (root)", "Test point"], "exit_methods": ["Power hold 10s"], "tools": ["edl", "shusboot"], "description": "Google Tensor EDL via GDSA."},
    {"name": "adb", "display_name": "ADB (USB Debugging)", "usb_ids": [{"vid": 6353, "pid": 3328}], "port_description_patterns": ["ADB", "Android"], "entry_methods": ["Enable USB debugging"], "exit_methods": ["adb disconnect"], "tools": ["adb"], "description": "Standard ADB mode."},
    {"name": "recovery", "display_name": "Recovery Mode", "usb_ids": [], "port_description_patterns": ["recovery"], "entry_methods": ["adb reboot recovery", "Volym Upp + Power"], "exit_methods": ["Reboot system now"], "tools": ["adb", "fastboot"], "description": "Stock recovery with ADB sideload."}
  ],
  "frp_methods": [
    {"id": "fastboot_erase_frp", "name": "Fastboot erase FRP", "category": "Fastboot", "success_rate": 0.95, "risk_level": "LOW", "prerequisites": ["Unlocked bootloader"], "steps": [{"step": 1, "description": "fastboot erase frp"}, {"step": 2, "description": "fastboot reboot"}], "requires_screen": false, "requires_adb": false, "requires_edl": false, "requires_root": false, "cost": "Free", "commands": ["fastboot:erase frp", "fastboot:reboot"]},
    {"id": "adb_gms_disable", "name": "ADB disable GMS", "category": "ADB", "success_rate": 0.80, "risk_level": "LOW", "prerequisites": ["USB debugging"], "steps": [{"step": 1, "description": "adb shell pm disable-user --user 0 com.google.android.gms"}, {"step": 2, "description": "adb reboot"}], "requires_screen": false, "requires_adb": true, "requires_edl": false, "requires_root": false, "cost": "Free", "commands": ["adb_shell:pm disable-user --user 0 com.google.android.gms", "adb:reboot"]}
  ],
  "unlock_methods": [{"id": "google_official", "name": "Google Official Bootloader Unlock", "success_rate": 1.0, "risk_level": "MEDIUM", "prerequisites": ["OEM Unlock enabled"], "steps": [{"step": 1, "description": "Enable OEM Unlock"}, {"step": 2, "description": "fastboot flashing unlock"}], "commands": ["fastboot:flashing unlock"], "official": true}],
  "partitions": [{"name": "frp", "purpose": "FRP lock data", "frp_relevant": true, "backup_before_write": true}, {"name": "userdata", "purpose": "User data", "frp_relevant": true, "backup_before_write": true}, {"name": "boot", "purpose": "Kernel + ramdisk", "frp_relevant": false, "backup_before_write": true}, {"name": "system", "purpose": "Android OS", "frp_relevant": false, "backup_before_write": true}, {"name": "vendor", "purpose": "Vendor", "frp_relevant": false, "backup_before_write": true}, {"name": "vbmeta", "purpose": "Verified Boot", "frp_relevant": false, "backup_before_write": true}],
  "service_codes": [{"code": "*#06#", "function": "IMEI"}, {"code": "*#*#4636#*#*", "function": "Phone Information"}],
  "talkback_shortcuts": {}
}
